{
  "schemaVersion": 1,
  "proxyURL": "http://127.0.0.1:9090",
  "defaults": {
    "selectorField": "operation",
    "caseInsensitiveSelector": true,
    "timeoutSeconds": 60,
    "serverName": "tool_aggregator"
  },
  "hiddenTools": [
    {
      "server": "facade",
      "tool": "search",
      "reason": "Placeholder verification tool no longer needed in manifests"
    }
  ],
  "aggregations": []
}
